{
  "plan": "okibi-warm-plan/1",
  "derived_from": {
    "digest": [
      "tests/golden/buildings-size-buckets/digest.jsonl"
    ],
    "invalidation": "sha256:0000000000000000000000000000000000000000000000000000000000000000",
    "manifests": {
      "buildings": "sha256:1111111111111111111111111111111111111111111111111111111111111111"
    }
  },
  "entries": [
    {
      "url": "https://buildings.reearth.land/t/overture-global/tileset.json",
      "service": "buildings",
      "priority": 1.0,
      "lane": "warm",
      "expected_gen_ms": 0.0,
      "saved_req_estimate": 20288.21007951151
    },
    {
      "url": "https://buildings.reearth.land/t/overture-global/13/7276/3225?s=overture-2026-08",
      "service": "buildings",
      "priority": 1.0,
      "lane": "warm",
      "expected_gen_ms": 5400.0,
      "saved_req_estimate": 1902.0196949542042
    },
    {
      "url": "https://buildings.reearth.land/t/overture-global/14/14552/6451?s=overture-2026-08",
      "service": "buildings",
      "priority": 0.8571428571428571,
      "lane": "warm",
      "expected_gen_ms": 5400.0,
      "saved_req_estimate": 1630.302595675032
    },
    {
      "url": "https://buildings.reearth.land/t/overture-global/13/7280/3227?s=overture-2026-08",
      "service": "buildings",
      "priority": 0.3442680776014109,
      "lane": "warm",
      "expected_gen_ms": 6100.0,
      "saved_req_estimate": 579.6631451289003
    },
    {
      "url": "https://buildings.reearth.land/t/overture-global/9/454/201?s=overture-2026-08",
      "service": "buildings",
      "priority": 0.05714285714285714,
      "lane": "warm",
      "expected_gen_ms": 5400.0,
      "saved_req_estimate": 108.68683971166881
    }
  ],
  "stats": {
    "total": 5,
    "sum_expected_gen_ms": 22300.0,
    "coverage_of_demand": 0.44506578947368425
  },
  "estimate": {
    "pricing": "tests/golden/buildings-size-buckets/pricing.json@sha256:2222222222222222222222222222222222222222222222222222222222222222",
    "warm": {
      "tiles": 5,
      "wall_clock_s": 2.7875,
      "cpu_ms": 22300.0,
      "usd": 0.00046849999999999995,
      "storage_delta_bytes": 922619.0
    },
    "no_warm": {
      "affected_first_requests": 1066.0,
      "user_wait_ms_total": 5883404.295051354,
      "p95_first_byte_ms": 10400.0
    },
    "marginal": [
      {
        "coverage": 0.5,
        "tiles": 1,
        "usd": 4.5e-6,
        "wall_clock_s": 0.25
      },
      {
        "coverage": 0.8,
        "tiles": 1,
        "usd": 4.5e-6,
        "wall_clock_s": 0.25
      },
      {
        "coverage": 0.9,
        "tiles": 2,
        "usd": 0.000117,
        "wall_clock_s": 0.675
      },
      {
        "coverage": 0.95,
        "tiles": 3,
        "usd": 0.0002295,
        "wall_clock_s": 1.35
      }
    ]
  }
}
